{
  "$schema": "../schemas/tenant.schema.json",
  "displayName": "Nerdy Potato",
  "fallbackDomain": "nerdypotato.onmicrosoft.com",
  "primaryDomain": "spaid.family",
  "environment": "production",
  "managedMarker": "Managed by sf-intune-cac. Do not edit in the portal.",
  "namePrefix": "CaC",
  "comment": [
    "2026-08-19: Microsoft renamed 'Microsoft 365 Copilot' to 'Microsoft Copilot' in place (packageId",
    "unchanged) as part of the consumer/work Copilot app merger. Renamed the adoption spec id to",
    "'android-copilot' and updated its displayName to match the live object, resolving a fail-closed",
    "one-time adoption Skip caused by the display name no longer matching.",
    "2026-09-18: Removed the one-time adoption entry for the manually-created 'SF Adults Local",
    "Admin' Settings Catalog policy. Adult/teen local admin rights now come from the Windows",
    "Autopilot profile's User account type = Administrator setting, scoped to the user joining",
    "their own device, not a broad tier-group MDM policy.",
    "2026-09-10: Added one-time adoption for the manually-created 'LAPS-Shell' Settings Catalog",
    "policy and paired it with a documented Windows LAPS Automatic Account Management OMA-URI",
    "policy so supported devices create/manage the x3nc0n local admin account.",
    "2026-09-10: LAPS-Shell was scaffolding only (existed so its live JSON payload could be",
    "captured/inspected). Replaced by the freshly-authored 'CaC - Windows LAPS' policy",
    "(config/intune/endpoint-security/laps.json), which deployed successfully via CI/CD. Removed",
    "the laps-shell adoption entry here; the live LAPS-Shell object is now an orphaned CaC-managed",
    "resource with no matching config and must be deleted via an approved apply",
    "(requireExplicitDeleteApproval / -AllowDelete).",
    "2026-09-29: Retired the enrolling-user local admin proactive remediation, the one-device local",
    "admin recovery flow, and the Autopilot Group Tag setter from this repository. Local admin comes",
    "from Autopilot/device preparation 'User account type = Administrator' plus the Entra device-join",
    "registering-users scope. Removing these files does not delete the deployed deviceHealthScripts",
    "object, any live recovery policy or group, or previously granted Graph permissions; retire those",
    "manually under an audited change - see docs/operations.md.",
    "2026-09-29: Device tier groups now key on administrator-assigned device extensionAttribute1",
    "(Adult/Teen/Child) instead of the Windows-only Autopilot Group Tag, so Android child devices are",
    "covered by the same rule. Tagging stays a manual per-device admin step and dynamic membership is",
    "eventually consistent - see docs/age-tiers.md.",
    "2026-09-29: Consolidated modern Windows LAPS into 'CaC - Windows LAPS - Account Management'.",
    "The legacy ADMX_AdmPwd policy (laps.json) is retained as transition-only scaffolding: removing",
    "it would schedule an orphan deletion of the live legacy policy before modern password backup to",
    "Entra ID is verified on a representative device. Retire both together, later, under review."
  ],
  "adoption": {
    "oneTime": true,
    "enabled": true,
    "groups": [
      {
        "id": "sg-autopilot-device-preparation-child",
        "displayName": "CaC-Autopilot-DevicePreparation-Child",
        "securityEnabled": true,
        "mailEnabled": false,
        "groupTypes": []
      },
      {
        "id": "sg-nuclear-family",
        "displayName": "NuclearFamily-SG",
        "securityEnabled": true,
        "mailEnabled": false,
        "groupTypes": []
      }
    ],
    "apps": [
      {
        "id": "android-defender",
        "displayName": "Microsoft Defender: Antivirus",
        "odataType": "#microsoft.graph.androidManagedStoreApp",
        "identity": { "kind": "packageId", "value": "com.microsoft.scmx" }
      },
      {
        "id": "android-copilot",
        "displayName": "Microsoft Copilot",
        "odataType": "#microsoft.graph.androidManagedStoreApp",
        "identity": { "kind": "packageId", "value": "com.microsoft.office.officehubrow" }
      },
      {
        "id": "android-word",
        "displayName": "Microsoft Word: Edit Documents",
        "odataType": "#microsoft.graph.androidManagedStoreApp",
        "identity": { "kind": "packageId", "value": "com.microsoft.office.word" }
      },
      {
        "id": "android-excel",
        "displayName": "Microsoft Excel: Spreadsheets",
        "odataType": "#microsoft.graph.androidManagedStoreApp",
        "identity": { "kind": "packageId", "value": "com.microsoft.office.excel" }
      },
      {
        "id": "android-powerpoint",
        "displayName": "Microsoft PowerPoint",
        "odataType": "#microsoft.graph.androidManagedStoreApp",
        "identity": { "kind": "packageId", "value": "com.microsoft.office.powerpoint" }
      },
      {
        "id": "android-onenote",
        "displayName": "Microsoft OneNote: Save Notes",
        "odataType": "#microsoft.graph.androidManagedStoreApp",
        "identity": { "kind": "packageId", "value": "com.microsoft.office.onenote" }
      },
      {
        "id": "android-outlook",
        "displayName": "Microsoft Outlook",
        "odataType": "#microsoft.graph.androidManagedStoreApp",
        "identity": { "kind": "packageId", "value": "com.microsoft.office.outlook" }
      },
      {
        "id": "android-teams",
        "displayName": "Microsoft Teams",
        "odataType": "#microsoft.graph.androidManagedStoreApp",
        "identity": { "kind": "packageId", "value": "com.microsoft.teams" }
      },
      {
        "id": "android-onedrive",
        "displayName": "Microsoft OneDrive",
        "odataType": "#microsoft.graph.androidManagedStoreApp",
        "identity": { "kind": "packageId", "value": "com.microsoft.skydrive" }
      },
      {
        "id": "android-edge",
        "displayName": "Microsoft Edge",
        "odataType": "#microsoft.graph.androidManagedStoreApp",
        "identity": { "kind": "packageId", "value": "com.microsoft.emmx" }
      },
      {
        "id": "android-chrome",
        "displayName": "Google Chrome",
        "odataType": "#microsoft.graph.androidManagedStoreApp",
        "identity": { "kind": "packageId", "value": "com.android.chrome" }
      },
      {
        "id": "android-spotify-kids",
        "displayName": "Spotify Kids",
        "odataType": "#microsoft.graph.androidManagedStoreApp",
        "identity": { "kind": "packageId", "value": "com.spotify.kids" }
      },
      {
        "id": "android-moonlight",
        "displayName": "Moonlight Game Streaming",
        "odataType": "#microsoft.graph.androidManagedStoreApp",
        "identity": { "kind": "packageId", "value": "com.limelight" }
      },
      {
        "id": "android-steam-link",
        "displayName": "Steam Link",
        "odataType": "#microsoft.graph.androidManagedStoreApp",
        "identity": { "kind": "packageId", "value": "com.valvesoftware.steamlink" }
      },
      {
        "id": "android-windows-app",
        "displayName": "Windows App",
        "odataType": "#microsoft.graph.androidManagedStoreApp",
        "identity": { "kind": "packageId", "value": "com.microsoft.rdc.androidx" }
      },
      {
        "id": "android-xbox",
        "displayName": "XBOX",
        "odataType": "#microsoft.graph.androidManagedStoreApp",
        "identity": { "kind": "packageId", "value": "com.microsoft.xboxone.smartglass" }
      }
    ],
    "policies": []
  },
  "safety": {
    "forbidAllUsersAssignment": true,
    "forbidAllDevicesAssignment": true,
    "requireExplicitDeleteApproval": true
  }
}
